<?xml version="1.0" encoding="UTF-8"?>
<personas xmlns:xsi="http://www.w3.org/2001/XMLSchema-instance"
 xsi:noNamespaceSchemaLocation="personas.xsd">
    <persona sexo="hombre">
        <dni>123347A</dni>
        <fnac>2000-02-12</fnac>
        <telefono tipo="fijo">913457837</telefono>
        <edad>21</edad>
        <incidencia>
            <codigo>123</codigo>
            <descripcion>No tiene datos</descripcion>
            <resuelto valor="si"/>
        </incidencia>
        <incidencia>
            <codigo>213</codigo>
            <descripcion>No da tono</descripcion>
            <resuelto valor="no"/>
        </incidencia>
    </persona>
    <persona sexo="mujer">
        <dni>454444B</dni>
        <fnac>1998-12-10</fnac>
        <telefono tipo="mÃ³vil">65456456</telefono>
        <edad>23</edad>
    </persona>
</personas>